{"$id":"mle-companion/dossier-record.schema.json","$schema":"https://json-schema.org/draft/2020-12/schema","additionalProperties":false,"properties":{"artifactVersion":{"const":"1.0.0"},"authorityCeiling":{"minLength":1,"type":"string"},"authorityRoute":{"minLength":1,"type":"string"},"chapterId":{"pattern":"^MLE-CH-[0-9]{2}$","type":"string"},"decision":{"minLength":1,"type":"string"},"disposition":{"const":"PASS"},"evidence":{"items":{"type":"string"},"minItems":1,"type":"array"},"fixedClock":{"format":"date-time","type":"string"},"fixedSeed":{"minLength":1,"type":"string"},"fixtureHash":{"pattern":"^[a-f0-9]{64}$","type":"string"},"fixtureId":{"minLength":1,"type":"string"},"incomingState":{"minLength":1,"type":"string"},"inputHash":{"pattern":"^[a-f0-9]{64}$","type":"string"},"labId":{"minLength":1,"type":"string"},"limitation":{"minLength":1,"type":"string"},"milestoneId":{"pattern":"^BL-[0-9]{2}$","type":"string"},"nextEvidence":{"minLength":1,"type":"string"},"outgoingState":{"minLength":1,"type":"string"},"outputHash":{"pattern":"^[a-f0-9]{64}$","type":"string"},"owner":{"minLength":1,"type":"string"},"priorHash":{"pattern":"^[a-f0-9]{64}$","type":"string"},"schema":{"const":"mle-companion-dossier-record/v1"},"truthState":{"const":"synthetic-deterministic"}},"required":["schema","artifactVersion","authorityCeiling","authorityRoute","chapterId","decision","disposition","evidence","fixedClock","fixedSeed","fixtureHash","fixtureId","incomingState","inputHash","labId","limitation","milestoneId","nextEvidence","outgoingState","outputHash","owner","priorHash","truthState"],"type":"object"}
