{"artifactVersion":"1.0.0","authorityCeiling":"The MLE owns model-workload envelope evidence, not generalized fleet reliability.","authorityRoute":"Route any approval, consequence, control, or shared-system decision to the named external owner.","chapterId":"MLE-CH-16","decision":"Measure representative demand, latency, error, capacity, staged exposure, bake/abort rules, and degraded mode for the workload.","disposition":"PASS","evidence":["BL-15 fixed-fixture contract satisfied","All authority decisions remain external to the companion."],"fixedClock":"2026-08-22T00:00:00.000Z","fixedSeed":"benchline-phase-08-seed-v1","fixtureHash":"980fa7d872bd5b896b2b0c5bc1cc7a28fca2bba5846be92965af3f9921da8c3a","fixtureId":"FIX-MLE-CH-16-1","incomingState":"RELEASABLE","inputHash":"70531907903f2a2b210e5f4640a675ec02798ef77fcfb805b7491a7e0f81f35d","labId":"MLE-CH-16-LAB-01","limitation":"This fixed synthetic result demonstrates contract mechanics only; it does not prove model quality, safety, legal or privacy approval, deployment readiness, production availability, fleet reliability, business value, or complete retirement of unknown paths.","milestoneId":"BL-15","nextEvidence":"Observation contract","outgoingState":"OPERABLE","outputHash":"ab57cd27fd84a84dcd0ede4da98766593f801d3eea7b8551430e0ae1b7fd1891","owner":"Platform/SRE own fleet capacity, SLOs, and incident command; product owns exposure intent.","priorHash":"70531907903f2a2b210e5f4640a675ec02798ef77fcfb805b7491a7e0f81f35d","schema":"mle-companion-dossier-record/v1","truthState":"synthetic-deterministic"}
