{"artifactVersion":"1.0.0","authorityCeiling":"The MLE owns workload experiment integrity, not the research agenda or independent gate.","authorityRoute":"Route any approval, consequence, control, or shared-system decision to the named external owner.","chapterId":"MLE-CH-07","decision":"Design a controlled experiment that retains the incumbent and changes only the claimed intervention.","disposition":"PASS","evidence":["BL-06 fixed-fixture contract satisfied","All authority decisions remain external to the companion."],"fixedClock":"2026-08-22T00:00:00.000Z","fixedSeed":"benchline-phase-08-seed-v1","fixtureHash":"89ef6142c0a5f92ff9adc71e52ea6a6103bc7f4eeb18ddd0351258984deb090d","fixtureId":"FIX-MLE-CH-07-1","incomingState":"ADMISSIBLE","inputHash":"51ceedb372eba68c9ac0c1893df150e03a3c3317307054a8b2d060f44fb6a9bc","labId":"MLE-CH-07-LAB-01","limitation":"This fixed synthetic result demonstrates contract mechanics only; it does not prove model quality, safety, legal or privacy approval, deployment readiness, production availability, fleet reliability, business value, or complete retirement of unknown paths.","milestoneId":"BL-06","nextEvidence":"Reconstruction manifest","outgoingState":"ADMISSIBLE","outputHash":"480ee12f47ac0ae8b776036e36c0bc55f25f4088f2499df15990fad190a970c0","owner":"Applied Science owns scientific novelty claims; evaluation retains suite adequacy.","priorHash":"51ceedb372eba68c9ac0c1893df150e03a3c3317307054a8b2d060f44fb6a9bc","schema":"mle-companion-dossier-record/v1","truthState":"synthetic-deterministic"}
