{"artifactVersion":"1.0.0","authorityCeiling":"The MLE implements/tests workload controls and routes exceptions but cannot self-approve them.","authorityRoute":"Route any approval, consequence, control, or shared-system decision to the named external owner.","chapterId":"MLE-CH-19","decision":"Integrate workload-specific control tests, exceptions, residual limits, and formal decisions accumulated since the task contract.","disposition":"PASS","evidence":["BL-18 fixed-fixture contract satisfied","All authority decisions remain external to the companion."],"fixedClock":"2026-08-22T00:00:00.000Z","fixedSeed":"benchline-phase-08-seed-v1","fixtureHash":"6f13987b693c0024c4138cc36992147cce576e49bcba08e80076e83af61c3780","fixtureId":"FIX-MLE-CH-19-1","incomingState":"REQUALIFIED","inputHash":"e2a76fed05d7bdaef4fc3210d9f662fd4d49253ea3de8f6fbd564e08287ac652","labId":"MLE-CH-19-LAB-01","limitation":"This fixed synthetic result demonstrates contract mechanics only; it does not prove model quality, safety, legal or privacy approval, deployment readiness, production availability, fleet reliability, business value, or complete retirement of unknown paths.","milestoneId":"BL-18","nextEvidence":"Retirement evidence","outgoingState":"CONTROLLED","outputHash":"a038164ffc192ef769b642db983b08663a8f2bc3ccfb97c5cac0f11d602d92a8","owner":"Security, safety, privacy, governance, legal, product, domain, and evaluation owners retain formal decisions.","priorHash":"e2a76fed05d7bdaef4fc3210d9f662fd4d49253ea3de8f6fbd564e08287ac652","schema":"mle-companion-dossier-record/v1","truthState":"synthetic-deterministic"}
