{"artifactVersion":"1.0.0","authorityCeiling":"The MLE owns workload-facing contracts and conformance, not the enterprise data estate or legal basis.","authorityRoute":"Route any approval, consequence, control, or shared-system decision to the named external owner.","chapterId":"MLE-CH-04","decision":"Define admissible dataset and label identities with provenance, access, retention, domain, and exception ownership.","disposition":"PASS","evidence":["BL-03 fixed-fixture contract satisfied","All authority decisions remain external to the companion."],"fixedClock":"2026-08-22T00:00:00.000Z","fixedSeed":"benchline-phase-08-seed-v1","fixtureHash":"402f24c53d7f55ae566d3146f4a38d6765171cc5a0e89dbc977958cf803e02ba","fixtureId":"FIX-MLE-CH-04-1","incomingState":"CONTRACTED","inputHash":"b591afccdab66159581571519f8d75476d263973f98f0ea3ecb53498b901d44f","labId":"MLE-CH-04-LAB-01","limitation":"This fixed synthetic result demonstrates contract mechanics only; it does not prove model quality, safety, legal or privacy approval, deployment readiness, production availability, fleet reliability, business value, or complete retirement of unknown paths.","milestoneId":"BL-03","nextEvidence":"Feature and lineage contract","outgoingState":"CONTRACTED","outputHash":"fb83c3e99ad732711d0951066dc4fab3e0adc6995e75293172f4003e8d2212a9","owner":"Data owners retain source truth, access, retention, and shared pipeline authority; domain owners retain label validity.","priorHash":"b591afccdab66159581571519f8d75476d263973f98f0ea3ecb53498b901d44f","schema":"mle-companion-dossier-record/v1","truthState":"synthetic-deterministic"}
