{"artifactVersion":"1.0.0","authorityCeiling":"The MLE assembles and verifies the workload package but cannot fabricate or substitute approvals.","authorityRoute":"Route any approval, consequence, control, or shared-system decision to the named external owner.","chapterId":"MLE-CH-13","decision":"Bind executable artifact, dependencies, interface, intended/excluded use, evaluated bounds, approvals, limitations, hashes, and previous-good target.","disposition":"PASS","evidence":["BL-12 fixed-fixture contract satisfied","All authority decisions remain external to the companion."],"fixedClock":"2026-08-22T00:00:00.000Z","fixedSeed":"benchline-phase-08-seed-v1","fixtureHash":"b0bace2c9aaf21b3638f0c516c683e350425b3234fba84eaa34209e42460557c","fixtureId":"FIX-MLE-CH-13-1","incomingState":"TECHNICALLY-QUALIFIED","inputHash":"e807e7d6a02a311cf3ce9a6a70f9c7ec9501120d68ab038731504f880d67ca98","labId":"MLE-CH-13-LAB-01","limitation":"This fixed synthetic result demonstrates contract mechanics only; it does not prove model quality, safety, legal or privacy approval, deployment readiness, production availability, fleet reliability, business value, or complete retirement of unknown paths.","milestoneId":"BL-12","nextEvidence":"Consumer compatibility contract","outgoingState":"TECHNICALLY-QUALIFIED","outputHash":"e8ad3ca31cb08eb03366448700ee6381211fb782a46476170a75b46261f47917","owner":"Security, platform, product, domain, and evaluation owners retain their formal approvals.","priorHash":"e807e7d6a02a311cf3ce9a6a70f9c7ec9501120d68ab038731504f880d67ca98","schema":"mle-companion-dossier-record/v1","truthState":"synthetic-deterministic"}
