{"artifactVersion":"1.0.0","authorityCeiling":"The MLE mentors through evidence review and routes systemic issues; it does not unilaterally set cross-team policy.","authorityRoute":"Route any approval, consequence, control, or shared-system decision to the named external owner.","chapterId":"MLE-CH-21","decision":"Hostile-review the complete dossier, derive one reusable workload standard, and route one systemic issue to its actual owner.","disposition":"PASS","evidence":["BL-20 fixed-fixture contract satisfied","All authority decisions remain external to the companion."],"fixedClock":"2026-08-22T00:00:00.000Z","fixedSeed":"benchline-phase-08-seed-v1","fixtureHash":"ad394bcd78a4cf81499ac4c8f975170fedffcdca262c8c34b24b6553fe3828c2","fixtureId":"FIX-MLE-CH-21-1","incomingState":"RETIRED","inputHash":"2b5a71599e51cb8bfdbf566304f6cff974bdd7df3ad1f0d1472475f912b2f208","labId":"MLE-CH-21-LAB-01","limitation":"This fixed synthetic result demonstrates contract mechanics only; it does not prove model quality, safety, legal or privacy approval, deployment readiness, production availability, fleet reliability, business value, or complete retirement of unknown paths.","milestoneId":"BL-20","nextEvidence":"No further evidence in this companion","outgoingState":"REVIEWED","outputHash":"298ee69ed7884756fee228a93dd7cfc7edd93cbc1c97ed7ea3970b12bcaeedb4","owner":"Each specialist retains its decision; organization owners decide shared platform or policy adoption.","priorHash":"2b5a71599e51cb8bfdbf566304f6cff974bdd7df3ad1f0d1472475f912b2f208","schema":"mle-companion-dossier-record/v1","truthState":"synthetic-deterministic"}
