{"artifactVersion":"1.0.0","authorityCeiling":"The MLE designs workload splits and conformance tests but cannot self-certify population validity.","authorityRoute":"Route any approval, consequence, control, or shared-system decision to the named external owner.","chapterId":"MLE-CH-06","decision":"Choose population-aware splits and prove that training and serving transformations conform.","disposition":"PASS","evidence":["BL-05 fixed-fixture contract satisfied","All authority decisions remain external to the companion."],"fixedClock":"2026-08-22T00:00:00.000Z","fixedSeed":"benchline-phase-08-seed-v1","fixtureHash":"2264d7a5e9420e108a1f1c4c9ae8d35a62e366149c304ea4597c878afd35e1e5","fixtureId":"FIX-MLE-CH-06-1","incomingState":"CONTRACTED","inputHash":"70fbc2bcc47d7521d10d89eede497b719b026db55607054d74fb9820fd2af04f","labId":"MLE-CH-06-LAB-01","limitation":"This fixed synthetic result demonstrates contract mechanics only; it does not prove model quality, safety, legal or privacy approval, deployment readiness, production availability, fleet reliability, business value, or complete retirement of unknown paths.","milestoneId":"BL-05","nextEvidence":"Controlled experiment record","outgoingState":"ADMISSIBLE","outputHash":"7d40fb4d42852f38c97d53da9b93681cf7b4d9d8b0745a8eb1c880e3c797a37f","owner":"Domain/evaluation owners judge representativeness; platform/data owners retain shared runtime/source authority.","priorHash":"70fbc2bcc47d7521d10d89eede497b719b026db55607054d74fb9820fd2af04f","schema":"mle-companion-dossier-record/v1","truthState":"synthetic-deterministic"}
