{"artifactVersion":"1.0.0","authorityCeiling":"The MLE implements/tests workload controls and supplies evidence without self-approving security exceptions.","authorityRoute":"Route any approval, consequence, control, or shared-system decision to the named external owner.","chapterId":"MLE-CH-15","decision":"Verify end-to-end lineage, inventory, integrity, access evidence, promotion packet, and previous-good recovery identity.","disposition":"PASS","evidence":["BL-14 fixed-fixture contract satisfied","All authority decisions remain external to the companion."],"fixedClock":"2026-08-22T00:00:00.000Z","fixedSeed":"benchline-phase-08-seed-v1","fixtureHash":"3f446a75fb57ac0d425f1132e866f6d8b68b17c8d7495965586a3d3b4c02a94f","fixtureId":"FIX-MLE-CH-15-1","incomingState":"TECHNICALLY-QUALIFIED","inputHash":"6a8e767373903db35f90f988313af87d00ddebad48651a83b48aa1f35a369f08","labId":"MLE-CH-15-LAB-01","limitation":"This fixed synthetic result demonstrates contract mechanics only; it does not prove model quality, safety, legal or privacy approval, deployment readiness, production availability, fleet reliability, business value, or complete retirement of unknown paths.","milestoneId":"BL-14","nextEvidence":"Operating envelope record","outgoingState":"RELEASABLE","outputHash":"31809a85434da720599e06676a98116425fb3524a65714f24da2408316c99929","owner":"Security owns control requirements and exceptions; platform owners own shared promotion mechanisms.","priorHash":"6a8e767373903db35f90f988313af87d00ddebad48651a83b48aa1f35a369f08","schema":"mle-companion-dossier-record/v1","truthState":"synthetic-deterministic"}
