{"artifactVersion":"1.0.0","authorityCeiling":"The MLE records and tests bounded reconstruction, not universal determinism.","authorityRoute":"Route any approval, consequence, control, or shared-system decision to the named external owner.","chapterId":"MLE-CH-08","decision":"Freeze code, data, dependency, parameter, seed, hardware, and execution-context identity and state the strongest supportable rerun claim.","disposition":"PASS","evidence":["BL-07 fixed-fixture contract satisfied","All authority decisions remain external to the companion."],"fixedClock":"2026-08-22T00:00:00.000Z","fixedSeed":"benchline-phase-08-seed-v1","fixtureHash":"f5e2f3089051a3712f5b54ea81490f84a08b8a904c76c6fb5cfd62423f26be44","fixtureId":"FIX-MLE-CH-08-1","incomingState":"ADMISSIBLE","inputHash":"e8116bff62ca7ef1aa00a5097a260b6a362586657efa43440310695c317ab051","labId":"MLE-CH-08-LAB-01","limitation":"This fixed synthetic result demonstrates contract mechanics only; it does not prove model quality, safety, legal or privacy approval, deployment readiness, production availability, fleet reliability, business value, or complete retirement of unknown paths.","milestoneId":"BL-07","nextEvidence":"Candidate nomination record","outgoingState":"RECONSTRUCTIBLE","outputHash":"b3f88b7da7d1d8c76b2d49f243cd2e9a2b43ce3dd944d8e8fbcec9cfa5ca3cac","owner":"Platform owners define supported runtime; research/evaluation owners retain claim-validity decisions.","priorHash":"e8116bff62ca7ef1aa00a5097a260b6a362586657efa43440310695c317ab051","schema":"mle-companion-dossier-record/v1","truthState":"synthetic-deterministic"}
