{"artifactVersion":"1.0.0","authorityCeiling":"The MLE verifies workload non-serving evidence but cannot set legal retention or shared-system policy.","authorityRoute":"Route any approval, consequence, control, or shared-system decision to the named external owner.","chapterId":"MLE-CH-20","decision":"Execute retirement across consumers, endpoints, credentials, monitoring, registry, retention, recovery, and archive, then prove no serving path remains.","disposition":"PASS","evidence":["BL-19 fixed-fixture contract satisfied","All authority decisions remain external to the companion."],"fixedClock":"2026-08-22T00:00:00.000Z","fixedSeed":"benchline-phase-08-seed-v1","fixtureHash":"f70f6b78cc33f98e99706c1821501e8b1e34bdc09fd3a7be5d8b034968f721e2","fixtureId":"FIX-MLE-CH-20-1","incomingState":"CONTROLLED","inputHash":"ac70c60ddee77d2b3b7ca2c7b3cb2d75998081f258dea505417179a32f7e20f0","labId":"MLE-CH-20-LAB-01","limitation":"This fixed synthetic result demonstrates contract mechanics only; it does not prove model quality, safety, legal or privacy approval, deployment readiness, production availability, fleet reliability, business value, or complete retirement of unknown paths.","milestoneId":"BL-19","nextEvidence":"Hostile-reviewed dossier","outgoingState":"RETIRED","outputHash":"010547914be2486a60a72b410dc62a3ee8f9a2d2e0d7906b0d1fbf09491df5fe","owner":"Product/domain/formal authorities approve retirement and retention; platform/security owners execute shared shutdown controls.","priorHash":"ac70c60ddee77d2b3b7ca2c7b3cb2d75998081f258dea505417179a32f7e20f0","schema":"mle-companion-dossier-record/v1","truthState":"synthetic-deterministic"}
