{"artifactVersion":"1.0.0","authorityCeiling":"The MLE implements and measures the incumbent but does not set business or domain tolerance alone.","authorityRoute":"Route any approval, consequence, control, or shared-system decision to the named external owner.","chapterId":"MLE-CH-03","decision":"Bind a measurable incumbent, consequence model, segment obligations, and acceptance target before candidate work.","disposition":"PASS","evidence":["BL-02 fixed-fixture contract satisfied","All authority decisions remain external to the companion."],"fixedClock":"2026-08-22T00:00:00.000Z","fixedSeed":"benchline-phase-08-seed-v1","fixtureHash":"e56b042345693ac0c55975c8ed3eaec866686cff73bb82897bfae0981b7eb09f","fixtureId":"FIX-MLE-CH-03-1","incomingState":"CONTRACTED","inputHash":"621cfe98286e805cf8523c739668e93e9f8d92104add916caa3e976ab680ccd0","labId":"MLE-CH-03-LAB-01","limitation":"This fixed synthetic result demonstrates contract mechanics only; it does not prove model quality, safety, legal or privacy approval, deployment readiness, production availability, fleet reliability, business value, or complete retirement of unknown paths.","milestoneId":"BL-02","nextEvidence":"Dataset and label identity","outgoingState":"CONTRACTED","outputHash":"8ede5089b37fc1a06d4f8461304c623ab752bfdf25bcaaa9aeeea54e039aafcb","owner":"Product and domain owners accept the consequence model; evaluation owns independent gate adequacy.","priorHash":"621cfe98286e805cf8523c739668e93e9f8d92104add916caa3e976ab680ccd0","schema":"mle-companion-dossier-record/v1","truthState":"synthetic-deterministic"}
