{"artifactVersion":"1.0.0","authorityCeiling":"The MLE validates workload compatibility but does not own every consuming application or agent effect.","authorityRoute":"Route any approval, consequence, control, or shared-system decision to the named external owner.","chapterId":"MLE-CH-14","decision":"Freeze request/response contracts, consumer identities, coexistence/migration evidence, and fallback ownership.","disposition":"PASS","evidence":["BL-13 fixed-fixture contract satisfied","All authority decisions remain external to the companion."],"fixedClock":"2026-08-22T00:00:00.000Z","fixedSeed":"benchline-phase-08-seed-v1","fixtureHash":"d653b42d50daa90b26831b4cb392654fd37d852efb465742557d3da5b878aaad","fixtureId":"FIX-MLE-CH-14-1","incomingState":"TECHNICALLY-QUALIFIED","inputHash":"eb9645e16376a74960f12317888436f294ca832406fa76b302089b9a3bf213dc","labId":"MLE-CH-14-LAB-01","limitation":"This fixed synthetic result demonstrates contract mechanics only; it does not prove model quality, safety, legal or privacy approval, deployment readiness, production availability, fleet reliability, business value, or complete retirement of unknown paths.","milestoneId":"BL-13","nextEvidence":"Promotion and recovery packet","outgoingState":"TECHNICALLY-QUALIFIED","outputHash":"8d120ed2bb59d5000615333481b4be5d8792737b6c0efd1713a0fa2dec23b3d4","owner":"Consumer/application owners accept product compatibility; platform owners own shared interface support.","priorHash":"eb9645e16376a74960f12317888436f294ca832406fa76b302089b9a3bf213dc","schema":"mle-companion-dossier-record/v1","truthState":"synthetic-deterministic"}
