{"artifactVersion":"1.0.0","authorityCeiling":"The MLE diagnoses workload evidence but cannot invent ground truth or automate formal disposition.","authorityRoute":"Route any approval, consequence, control, or shared-system decision to the named external owner.","chapterId":"MLE-CH-17","decision":"Bind observation signals, delayed labels, proxies, drift, segments, owners, and alert-to-decision routes without automatic truth claims.","disposition":"PASS","evidence":["BL-16 fixed-fixture contract satisfied","All authority decisions remain external to the companion."],"fixedClock":"2026-08-22T00:00:00.000Z","fixedSeed":"benchline-phase-08-seed-v1","fixtureHash":"aeca09750262e578d40087f60578a98cab44a2ad88fc2d12aa2faebd7f78d833","fixtureId":"FIX-MLE-CH-17-1","incomingState":"OPERABLE","inputHash":"86f363f418cfd2434187fafa234902d331eb9fd07ad71d5e5567c237bf89f5ba","labId":"MLE-CH-17-LAB-01","limitation":"This fixed synthetic result demonstrates contract mechanics only; it does not prove model quality, safety, legal or privacy approval, deployment readiness, production availability, fleet reliability, business value, or complete retirement of unknown paths.","milestoneId":"BL-16","nextEvidence":"Incident and repair evidence","outgoingState":"OBSERVED","outputHash":"07bf30b9fa2d36579deda078c816d1c9c469b23100c0be15e9e5e7d1352bf050","owner":"Evaluation/domain owners define sufficient evidence; SRE/platform own shared telemetry and incident mechanisms.","priorHash":"86f363f418cfd2434187fafa234902d331eb9fd07ad71d5e5567c237bf89f5ba","schema":"mle-companion-dossier-record/v1","truthState":"synthetic-deterministic"}
