{"artifactVersion":"1.0.0","authorityCeiling":"The MLE owns model-specific diagnosis and repair evidence, not fleet command or risk acceptance.","authorityRoute":"Route any approval, consequence, control, or shared-system decision to the named external owner.","chapterId":"MLE-CH-18","decision":"Separate incident command from workload diagnosis, contain or roll back, bind changed evidence, and require a new candidate identity after repair.","disposition":"PASS","evidence":["BL-17 fixed-fixture contract satisfied","All authority decisions remain external to the companion."],"fixedClock":"2026-08-22T00:00:00.000Z","fixedSeed":"benchline-phase-08-seed-v1","fixtureHash":"c9a1df89188f4b26ee1ad5a2d19f9ad07a193f0b8933806934d6c7e602e5a498","fixtureId":"FIX-MLE-CH-18-1","incomingState":"OBSERVED","inputHash":"b0f3e38b3db4030dc454de787cdbf8fe6890e36039a3ae50fe37d73cd782caf0","labId":"MLE-CH-18-LAB-01","limitation":"This fixed synthetic result demonstrates contract mechanics only; it does not prove model quality, safety, legal or privacy approval, deployment readiness, production availability, fleet reliability, business value, or complete retirement of unknown paths.","milestoneId":"BL-17","nextEvidence":"Control decision record","outgoingState":"REQUALIFIED","outputHash":"8d43f3c378148988e402c6433971dfd7c6182344e84e5502a6f75cfef92dd93c","owner":"SRE owns incident command/fleet action; evaluation and formal authorities retain their gates.","priorHash":"b0f3e38b3db4030dc454de787cdbf8fe6890e36039a3ae50fe37d73cd782caf0","schema":"mle-companion-dossier-record/v1","truthState":"synthetic-deterministic"}
