{"artifactVersion":"1.0.0","authorityCeiling":"The MLE specifies and tests workload transformations, not enterprise data-platform topology.","authorityRoute":"Route any approval, consequence, control, or shared-system decision to the named external owner.","chapterId":"MLE-CH-05","decision":"Bind feature identity, transformations, feedback arrival, and source/consumer lineage without owning shared data architecture.","disposition":"PASS","evidence":["BL-04 fixed-fixture contract satisfied","All authority decisions remain external to the companion."],"fixedClock":"2026-08-22T00:00:00.000Z","fixedSeed":"benchline-phase-08-seed-v1","fixtureHash":"9ddb595d5ca76ec10eec1985c579673b74b78a58d5b91693712a13eae3963ab1","fixtureId":"FIX-MLE-CH-05-1","incomingState":"CONTRACTED","inputHash":"2c102c6a4c774db7fd168d785a5730619b927ffcb20e2f40ad6e70baa956b6ae","labId":"MLE-CH-05-LAB-01","limitation":"This fixed synthetic result demonstrates contract mechanics only; it does not prove model quality, safety, legal or privacy approval, deployment readiness, production availability, fleet reliability, business value, or complete retirement of unknown paths.","milestoneId":"BL-04","nextEvidence":"Population-aware split evidence","outgoingState":"CONTRACTED","outputHash":"fa4e834a48a673f00c4a0ee49188437b15fec6f754c9ce7f614c80d63596507b","owner":"Data/platform owners retain shared sources and services; consumers own their product behavior.","priorHash":"2c102c6a4c774db7fd168d785a5730619b927ffcb20e2f40ad6e70baa956b6ae","schema":"mle-companion-dossier-record/v1","truthState":"synthetic-deterministic"}
