{"artifactVersion":"1.0.0","authorityCeiling":"The MLE nominates a candidate but cannot self-certify the independent gate.","authorityRoute":"Route any approval, consequence, control, or shared-system decision to the named external owner.","chapterId":"MLE-CH-09","decision":"Select a candidate for qualification while retaining baseline, failed candidates, limitations, and evidence lineage.","disposition":"PASS","evidence":["BL-08 fixed-fixture contract satisfied","All authority decisions remain external to the companion."],"fixedClock":"2026-08-22T00:00:00.000Z","fixedSeed":"benchline-phase-08-seed-v1","fixtureHash":"d8c01944cd62baf07b1b3bdb3fef8533d2d782af295390e6a35b81840368ab9d","fixtureId":"FIX-MLE-CH-09-1","incomingState":"RECONSTRUCTIBLE","inputHash":"674536448cb3e32eb2bd747d6612e077b8de6930c6cb2a5693c88c2a55e99f5c","labId":"MLE-CH-09-LAB-01","limitation":"This fixed synthetic result demonstrates contract mechanics only; it does not prove model quality, safety, legal or privacy approval, deployment readiness, production availability, fleet reliability, business value, or complete retirement of unknown paths.","milestoneId":"BL-08","nextEvidence":"Representative segment suite","outgoingState":"CANDIDATE","outputHash":"1a2e24e6b3a982ee82f66a2a1d362d3aa8fe140226d3b70f5ba7141647370f0d","owner":"Evaluation retains qualification validity; Applied Science retains scientific-claim authority.","priorHash":"674536448cb3e32eb2bd747d6612e077b8de6930c6cb2a5693c88c2a55e99f5c","schema":"mle-companion-dossier-record/v1","truthState":"synthetic-deterministic"}
