{"artifactVersion":"1.0.0","authorityCeiling":"The MLE identifies and supplies evidence but does not absorb adjacent authority.","authorityRoute":"Route any approval, consequence, control, or shared-system decision to the named external owner.","chapterId":"MLE-CH-01","decision":"Locate the workload-specific MLE decision inside the full lifecycle and authority map.","disposition":"PASS","evidence":["BL-00 fixed-fixture contract satisfied","All authority decisions remain external to the companion."],"fixedClock":"2026-08-22T00:00:00.000Z","fixedSeed":"benchline-phase-08-seed-v1","fixtureHash":"0469d438629e39b55d3948189debc58a50e9d224b359d4ef5714bc5ed1449c0e","fixtureId":"FIX-MLE-CH-01-1","incomingState":"UNORIENTED","inputHash":"24b2ef5873262d45c5fbf5df16386dfc7df434fc56295a35b25d32fa2a32c8c9","labId":"MLE-CH-01-LAB-01","limitation":"This fixed synthetic result demonstrates contract mechanics only; it does not prove model quality, safety, legal or privacy approval, deployment readiness, production availability, fleet reliability, business value, or complete retirement of unknown paths.","milestoneId":"BL-00","nextEvidence":"Task and authority contract","outgoingState":"ORIENTED","outputHash":"a1125363375b1dd1f7a1e1154cb2c2c0e41839784ecfa985893ca9b0a7a6c1de","owner":"Product and domain authorities own purpose; named specialists own formal gates.","priorHash":"24b2ef5873262d45c5fbf5df16386dfc7df434fc56295a35b25d32fa2a32c8c9","schema":"mle-companion-dossier-record/v1","truthState":"synthetic-deterministic"}
