{"artifactVersion":"1.0.0","authorityCeiling":"The MLE translates an approved purpose into technical evidence requirements but cannot authorize it.","authorityRoute":"Route any approval, consequence, control, or shared-system decision to the named external owner.","chapterId":"MLE-CH-02","decision":"Convert an approved purpose into a bounded task contract with explicit decision owners and a NO-ML or HOLD path.","disposition":"PASS","evidence":["BL-01 fixed-fixture contract satisfied","All authority decisions remain external to the companion."],"fixedClock":"2026-08-22T00:00:00.000Z","fixedSeed":"benchline-phase-08-seed-v1","fixtureHash":"4b0f28329b871941a81c22d7d170c340b22c8411730e861712c2f029ce615c27","fixtureId":"FIX-MLE-CH-02-1","incomingState":"ORIENTED","inputHash":"d362f770784ae16fb94bb14522bbe0163e1f3d8f5f645cbaf500ad87217c6d7c","labId":"MLE-CH-02-LAB-01","limitation":"This fixed synthetic result demonstrates contract mechanics only; it does not prove model quality, safety, legal or privacy approval, deployment readiness, production availability, fleet reliability, business value, or complete retirement of unknown paths.","milestoneId":"BL-01","nextEvidence":"Incumbent and consequence contract","outgoingState":"CONTRACTED","outputHash":"97cbe378dbb86de5aebd192e3a30a7cf183afb0b0e0cc69e600533ffd7ba9cc6","owner":"Product owns purpose and priority; domain and formal authorities own validity and permissibility.","priorHash":"d362f770784ae16fb94bb14522bbe0163e1f3d8f5f645cbaf500ad87217c6d7c","schema":"mle-companion-dossier-record/v1","truthState":"synthetic-deterministic"}
