{"artifactVersion":"1.0.0","authorityCeiling":"The MLE implements, diagnoses, and remediates but cannot waive a consequential gate.","authorityRoute":"Route any approval, consequence, control, or shared-system decision to the named external owner.","chapterId":"MLE-CH-10","decision":"Build a representative suite and segment gate whose thresholds follow consequence rather than aggregate convenience.","disposition":"PASS","evidence":["BL-09 fixed-fixture contract satisfied","All authority decisions remain external to the companion."],"fixedClock":"2026-08-22T00:00:00.000Z","fixedSeed":"benchline-phase-08-seed-v1","fixtureHash":"a8f4f967a1ba3d57232ceee8495abdf394e89d64b57e110a514852019735af3f","fixtureId":"FIX-MLE-CH-10-1","incomingState":"CANDIDATE","inputHash":"8f6ba0dc4b80505ecb213014bb027f8c20e45737d08503c12589219c903b5324","labId":"MLE-CH-10-LAB-01","limitation":"This fixed synthetic result demonstrates contract mechanics only; it does not prove model quality, safety, legal or privacy approval, deployment readiness, production availability, fleet reliability, business value, or complete retirement of unknown paths.","milestoneId":"BL-09","nextEvidence":"Uncertainty and error record","outgoingState":"CANDIDATE","outputHash":"37fe90c3ff364c8a2e93031e1fbdfd1e0007c3d31a89e24187d54bb7e2a7b924","owner":"Evaluation owns suite adequacy; product/domain/formal authorities own acceptable consequences.","priorHash":"8f6ba0dc4b80505ecb213014bb027f8c20e45737d08503c12589219c903b5324","schema":"mle-companion-dossier-record/v1","truthState":"synthetic-deterministic"}
