{"artifactVersion":"1.0.0","authorityCeiling":"The MLE computes and diagnoses evidence but cannot turn method output into formal acceptance.","authorityRoute":"Route any approval, consequence, control, or shared-system decision to the named external owner.","chapterId":"MLE-CH-11","decision":"Record uncertainty or calibration where applicable, sample limits, error taxonomy, and unresolved evidence.","disposition":"PASS","evidence":["BL-10 fixed-fixture contract satisfied","All authority decisions remain external to the companion."],"fixedClock":"2026-08-22T00:00:00.000Z","fixedSeed":"benchline-phase-08-seed-v1","fixtureHash":"e0b2223b42c8205873eb9d9e68f7447e7a383dffe4366a97e4887293d2485c6c","fixtureId":"FIX-MLE-CH-11-1","incomingState":"CANDIDATE","inputHash":"b5a89e2af76e5813a1b49e263d90f708276fc5fa5871119e391528187d5641c1","labId":"MLE-CH-11-LAB-01","limitation":"This fixed synthetic result demonstrates contract mechanics only; it does not prove model quality, safety, legal or privacy approval, deployment readiness, production availability, fleet reliability, business value, or complete retirement of unknown paths.","milestoneId":"BL-10","nextEvidence":"Technical qualification disposition","outgoingState":"CANDIDATE","outputHash":"847414339d550856249912125d459c464625c10a458740ac23d0ff089c2c00fa","owner":"Evaluation owns method adequacy; domain/safety authorities judge consequential error sufficiency.","priorHash":"b5a89e2af76e5813a1b49e263d90f708276fc5fa5871119e391528187d5641c1","schema":"mle-companion-dossier-record/v1","truthState":"synthetic-deterministic"}
