{"artifactVersion":"1.0.0","authorityCeiling":"The MLE issues the workload technical disposition and routes external decisions; it cannot self-approve them.","authorityRoute":"Route any approval, consequence, control, or shared-system decision to the named external owner.","chapterId":"MLE-CH-12","decision":"Combine population, segment, uncertainty, consequence, limitation, owner, and rollback evidence into PASS, HOLD, or REJECT.","disposition":"PASS","evidence":["BL-11 fixed-fixture contract satisfied","All authority decisions remain external to the companion."],"fixedClock":"2026-08-22T00:00:00.000Z","fixedSeed":"benchline-phase-08-seed-v1","fixtureHash":"cefa292faf66bebc4f70345e4b23f9f3e0eecc88ebd0bf89f4ea03daaef670d4","fixtureId":"FIX-MLE-CH-12-1","incomingState":"CANDIDATE","inputHash":"c4e0231741e6b75a4a6b0e4b6930351e75459d677298f83a66ed19803da899f8","labId":"MLE-CH-12-LAB-01","limitation":"This fixed synthetic result demonstrates contract mechanics only; it does not prove model quality, safety, legal or privacy approval, deployment readiness, production availability, fleet reliability, business value, or complete retirement of unknown paths.","milestoneId":"BL-11","nextEvidence":"Immutable executable package","outgoingState":"TECHNICALLY-QUALIFIED","outputHash":"88730136eeab1cf5c726dc98b20c10a2fc29fedb099cc7ae10ac1f2a1d072a89","owner":"Independent evaluation and relevant formal authorities retain stop-ship and acceptance decisions.","priorHash":"c4e0231741e6b75a4a6b0e4b6930351e75459d677298f83a66ed19803da899f8","schema":"mle-companion-dossier-record/v1","truthState":"synthetic-deterministic"}
